{
  "$schema": "http://json-schema.org/draft-07/schema#",
  "$id": "https://tensdireito.com/dados/observacoes/schema.json",
  "title": "Observação de fonte oficial — Tens Direito",
  "description": "Um ficheiro por fonte monitorizada (dados/observacoes/<slug>.json), sobrescrito no lugar a cada mudança substantiva de conteúdo. O historial vive no `git log` de cada ficheiro, nunca num array dentro do JSON. Ver scripts/registar_observacao.py.",
  "type": "object",
  "required": [
    "fonte",
    "fonte_url",
    "data_extracao",
    "sha256_conteudo",
    "estado",
    "valores_extraidos"
  ],
  "additionalProperties": false,
  "properties": {
    "fonte": {
      "type": "string",
      "minLength": 1,
      "description": "Slug da fonte — tem de bater com o nome do ficheiro (sem .json)."
    },
    "fonte_url": {
      "type": "string",
      "minLength": 1,
      "format": "uri"
    },
    "data_extracao": {
      "type": "string",
      "format": "date-time",
      "description": "ISO 8601 UTC, do campo data_acesso do scraper."
    },
    "sha256_conteudo": {
      "type": "string",
      "pattern": "^[0-9a-f]{64}$"
    },
    "estado": {
      "type": "string",
      "enum": ["OK", "BLOQUEADO", "MUDOU", "DESCONHECIDO"],
      "description": "Reflecte scripts/classificador_resposta.py::Estado. Um bloqueio nunca aparece aqui como OK."
    },
    "valores_extraidos": {
      "type": ["object", "null"],
      "description": "Conteúdo estruturado extraído (título/parágrafos/itens) quando estado=OK; null nos outros casos, sempre acompanhado de 'motivo'."
    },
    "motivo": {
      "type": "string",
      "minLength": 1,
      "description": "Obrigatório quando valores_extraidos é null — explica porque não há conteúdo fiável."
    },
    "modo": {
      "type": "string",
      "enum": ["arquivo"],
      "description": "Presente só quando o conteúdo veio de um snapshot Wayback (OK_VIA_ARQUIVO)."
    },
    "data_snapshot": {
      "type": ["string", "null"]
    },
    "url_snapshot": {
      "type": ["string", "null"],
      "format": "uri"
    }
  },
  "allOf": [
    {
      "if": { "properties": { "valores_extraidos": { "type": "null" } } },
      "then": { "required": ["motivo"] }
    }
  ]
}
