{
  "fonte": "igefe_mega",
  "fonte_url": "https://www.igefe.mec.pt/Page/Index/199",
  "data_extracao": "2026-07-06T07:21:13.002438+00:00",
  "sha256_conteudo": "5592a88df6bae0770172565d834d6384569bea49e27db4679b20c39e12112c0d",
  "estado": "OK",
  "valores_extraidos": {
    "titulo": "MEGA – Manuais Escolares Gratuitos",
    "paragrafos": [
      "LIVRARIAS - MEGA Encontra-se a decorrer o processo de registo de livrarias no âmbito do Programa MEGA – Manuais Escolares Gratuitos , para o ano letivo 2025/2026. Para que possam ser consideradas livrarias associadas ao programa MEGA , as entidades interessadas devem efetuar o respetivo registo com a maior brevidade possível, através das seguintes plataformas: Portal: www.manuaisescolares.pt Aplicação móvel: Edu Rede Escolar (disponível para Android e iOS) Edu Rede Escolar – Apps no Google Play Durante o processo de registo, é obrigatória a apresentação dos documentos de habilitação indicados na plataforma, nomeadamente os que comprovam o exercício legal da a sua atividade. Emissão de Vouchers A emissão dos vouchers para manuais escolares gratuitos terá início a partir do dia 28 de julho de 2025, sendo essencial que as livrarias interessadas concluam o seu registo antes dessa data, de forma a garantir a sua inclusão na rede de distribuição autorizada. Perguntas Frequentes FAQs"
    ],
    "itens_lista": [
      "O IGeFE O IGeFE Conselho Diretivo Estrutura Orgânica Instrumentos de Gestão Instrumentos Legais Recursos Humanos Organograma Legislação Qualidade Projetos Financiados RGPD Consultas Públicas",
      "PRR PRR Documentção PRR Investimento C06 Investimento C19 Investimento C20",
      "Login GesEdu (Estab. de Ensino) Docentes Municípios",
      "Página Inicial",
      "MEGA – Manuais Escolares Gratuitos",
      "Portal: www.manuaisescolares.pt",
      "Aplicação móvel: Edu Rede Escolar (disponível para Android e iOS) Edu Rede Escolar – Apps no Google Play"
    ]
  }
}
